,name,description,price,product_details,variatal,size,country,closure,target
0,laphroaig,quarter cask scotch whisky 700ml,84.95,"the quarter cask is a strong, double cask matured, non-chill filtered malt from the iconic islay distillery, laphroaig. with a nose of burning peat embers and hints of coconut and bananas that is then followed by a palate that is deep and complex with smoky flavours. still quite gentle with a hint of sweetness, this 48% single malt has a long, spicy and smoky finish that seems to last an eternity.",single malt,700.0,scotland,cork,0
1,laphroaig,10 year old single malt scotch whisky 700ml,79.95,"laphroaig, founded in 1815 by brothers donald and alexander johnston, has an extremely rich history; neighbourly disputes with lagavulin and many ownership changes to name a couple. the 10 year old single malt is laphroaig's signature malt that is full sparkling gold in colour and has that signature rich smoke and seaweed character with a hint of sweetness. surprisingly the palate is rich with subtle sweet hints and complex layers of salt and peatiness that evolve on the palate and continue to the long and dry finish.",single malt,700.0,scotland,unknown,0
2,glenfarclas,15 year old single malt scotch whisky 700ml,109.95,15 year old single malt scotch whisky 700ml,single malt,700.0,scotland,unknown,1
3,glenfarclas,12 year old single malt scotch whisky 700ml,115.99,"don't be fooled by the nose into thinking this is a delicate and gentle highlander, glenfarclas is a brute at close quarters! layers of flavour just keep coming and it is a true pleasure to savour.",single malt,700.0,scotland,unknown,1
4,glenfiddich,12 year old single malt scotch whisky 700ml,61.95,"after 12 years, this signature single malt by glenfiddich - the pioneer of the prestigious single malt category - offers a distinctive fresh and fruity nose with a hint of pear followed by a palate of butterscotch, cream, malt and a subtle oak thanks to its long maturation in oloroso sherry and bourbon oak casks.",single malt,700.0,scotland,cork,0
5,glenfiddich,15 year old single malt scotch whisky 700ml,89.95,"the richly layered glenfiddich 15 year old single malt scotch whisky is innovatively matured in three types of oak cask: sherry, bourbon and new oak, before being married in thier unique, handcrafted oregon pine solera vat. year on year, this solera vat is never emptied but is always kept at least half full creating a deliciously harmonious and intense whisky which gets more complex and intriguing every year.",single malt,700.0,scotland,unknown,0
6,glenfarclas,21 year old single malt scotch whisky 700ml,149.95,this single malt whisky is the result of over 170 years of tradition and experience. sweet malt and smoky peat wreath the gorgeous palate. an outstanding whisky.,single malt,700.0,scotland,unknown,1
7,glenmorangie,the original single malt scotch whisky 10 year old 700ml,69.95,"located in the far north of scotland, glenmorangie distillery uses the tallest stills in scotland, where only the lightest and purist spirit vapours reach the top, giving glenmorangie its hallmark floral and fruity character.",single malt,700.0,scotland,cork,0
8,port ellen,35 year old scotch whisky 700ml,3998.95,"a glorious grande dame, superb in every way and with a poise and self-assurance born of long experience. an unexpected port ellen with a warming, spicy, gingery edge to its traditional sweet and smoky nature: captivating at cask strength, while a little water reveals a charming sweetness in the nose and richness and depth on the palate.",blended,700.0,scotland,cork,1
9,the glenlivet,founder's reserve single malt scotch whisky 700ml,55.9,"the glenlivet founder's reserve, skilful selection of casks enhances the signature fruity flavours of the glenlivet with traditional oak casks being complemented by selective use of american first-fill casks to give a hint of creamy sweetness, creating an exceptionally well-balanced and smooth malt.",single malt,700.0,scotland,cork,0
10,glenfarclas,25 year old single malt scotch whisky 700ml,199.95,this timeless distillery has produced yet another astonishing scotch. the sheer depth and complexity is truly a wonder to behold. for the true whisky connoisseur.,single malt,700.0,scotland,unknown,1
11,laphroaig,select cask scotch whisky 700ml,69.95,"this special laphroaig is crafted from carefully selected casks from each of the distillery's key styles - with one notable addition. the heart of this single malt is drawn from a final maturation in new american oak casks, a rarity used for scotch whisky maturation. with spirit selected by the master distiller from quarter cask, px cask and triple wood (european oak casks) and a final addition of 10 year old, the whisky represents a subtle blending of peat, oak and sweetness. this is a full-bodied expression, featuring laphroaig's trademark 'peat reek' matched by an additional layer of complexity and depth brought about by the fusion of the maturation styles and different oaks.",single malt,700.0,scotland,cork,0
12,aberlour,12 year old double cask single malt scotch whisky 700ml,84.95,"the gateway to double cask maturation, aberlour 12 year old double cask matured has balanced notes of fruits and spices. golden amber with hints of ruby red. soft and rounded with fruity notes of red apples. sherried character and fruity aromas balanced with a rich chocolate, toffee, cinnamon and ginger spices. warming and lingering with some smoky notes and gentle pepperiness.",single malt,700.0,scotland,cork,0
13,talisker,18 year old single malt scotch whisky 700ml,150.0,"produced at the oldest distillery on the isle of skye, talisker single malt scotch whisky has been made by the sea since 1830, talisker single malt scotch whisky has been “made by the sea” since 1830. in fact, few single malts tell the story of their origin better. its smell and taste instantly connect the drinker with the rugged coastal environment. every sip is a taste of the isle of skye itself – a powerhouse; challenging but adored, once discovered rarely left. like a warm welcome from a wild sea. the intense character of talisker comes from fresh water drawn directly from underground springs next to the distillery, two very distinctive wash stills and wooden worm tub condensers which, along with its unusual abv of 45.8%, help set talisker apart from other malts.",single malt,700.0,scotland,unknown,1
14,glen moray,classic single malt scotch whisky 700ml,42.9,"distilled since 1897. a subtle speyside malt, glen moray is matured in oak casks producing a whisky which is light gold in colour and gently spiced with fruity butterscotch notes.",single malt,700.0,scotland,unknown,0
15,talisker,10 year old single malt scotch whisky 700ml,79.95,"produced at the oldest distillery on the isle of skye, talisker single malt scotch whisky has been made by the sea since 1830, it is the stalwart of the talisker family, with a spicy complexity, peppery character, smoky smoothness and sweet, lingering peaty finish.",single malt,700.0,scotland,unknown,0
16,the balvenie,14yo caribbean cask single malt scotch whisky 700ml,119.95,"balvenie caribbean cask was created by the balvenie malt master, david stewart, who celebrated an incredible 50th anniversary at the distillery in 2012. 14 years maturation in traditional oak casks & finished in caribbean rum casks. expect notes of vanilla, toffee, nutmeg & subtle rum soaked raisins.",single malt,700.0,scotland,cork,1
17,lagavulin,16 year old islay single malt scotch whisky 700ml,119.95,"discover the distinct flavours of the islands of scotland with a swill of lagavulin 16 year old islay single malt scotch whisky. our whisky has the intense, full-bodied flavour reminiscent of a driftwood fire at dusk. the taste of dry peat smoke with strong maritime notes results in a complex dram that is complemented by a long, elegant finish",single malt,700.0,scotland,unknown,1
18,spey river,12 year old single malt scotch whisky 700ml,58.0,"spey river 12 year old is a collection of some of the finest single malt scotch whiskies from the renowned speyside region of scotland. known for its combination of refined flavour, aroma and excellence, this speyside malt delivers on all fronts with a level of complexity that is hard to find.",single malt,700.0,scotland,unknown,0
19,the shinobu pure mal,15 year mizunara oak finish whisky,210.0,"deep wood aroma, maltose, nectar, blueberry, mizunara oak, milk coffee; oily, ripe fruit, lemon peel, leather, cinnamon, ginger. finished with a hint of sweet malt with aromas of wooden barrels and a touch of fruity flavor.

summary: this is richer in taste than the 10-year-old whisky. the sweet aftertaste is outstanding; mizunara barrel brings out different levels of spice flavors. deep floral woody scent is also full of vitality.
 
tasting notes:
colour: old gold
nose: deep wood aroma, maltose, nectar, blueberry, mizunara oak, milk coffee
palate: oily, ripe fruit, lemon peel, leather, cinnamon, ginger

finish: a hint of sweet malt with aromas of wooden barrels and a touch of fruity flavor.",blended,700.0,15 year old,unknown,1
20,hakushu,12 year old whisky 700ml,320.0,"the hakushu distillery is know as the 'mountain forest distillery' as it stands amidst fresh streams and lush forests. built with the notion, 'coexisting with nature', a bird sanctuary was set up to help preserve the natural environment, thus preserving the pristine water that goes into creating the whisky. the 12 year old single malt whisky has a crisp and vibrant taste and can be enjoyed on neat, on the rocks or with ice and soda water.",single malt,700.0,hakushu,cork,1
21,hakushu,single malt whisky 700ml,119.99,"produced from the pure waters of the southern japanese alps, hakushu distillers reserve is a green and fresh whisky with a crisp and vibrant taste. now, for the first time ever, this whisky is available outside of japan.",single malt,700.0,japan,cork,1
22,talisker,port ruighe single malt scotch whisky 700ml,92.0,"double matured in port casks, this malt is a toast to the scottish traders who braved the high seas and were instrumental in founding the port wine trade, shipping it to the world. 'port ruighe' (pronounced 'portree') is the gaelic spelling of the once bustling trading port on skye. the port finish combines talisker's powerful maritime character with succulent sweet notes of rich berry fruits for a superb contrasting taste experience.",single malt,700.0,scotland,unknown,0
23,the macallan,12 year old triple cask matured single malt scotch whisky 700ml,109.95,"the macallan triple cask matured 12 years old sees the expert marrying of a series of single malt whiskies. these have been crafted in a triple cask combination of european and american sherry seasoned oak casks and american ex-bourbon oak casks. this complex combination of oak casks delivers an extraordinarily smooth and delicate character, full of citrus fruits, vanilla and fresh oak.",single malt,700.0,scotland,unknown,1
24,glenmorangie,the lasanta single malt scotch whisky 700ml,89.95,"a traditional, non-chill filtered whisky aged in sherry and bourbon casks. extra long maturation lends elegance, depth and warmth, and a soft, rich palate that is tantalising and entrancing.",single malt,700.0,scotland,cork,0
25,the balvenie,17 year old doublewood single malt scotch 700ml,177.99,"balvenie's elder sibling to doublewood 12 year old, shares similar characteristics to their most popular expression but has a distinctly different taste, with deeper vanilla notes, hints of green apple, creamy toffee and a lovely richness and complexity. 'cask finishing' - the defining technique of balvenie doublewood, involves the whisky matured first in american oak casks and then in european oak sherry casks, each adding their own character to the scotch.",single malt,700.0,scotland,unknown,1
26,the glenlivet,12 year old single malt scotch whisky 700ml,69.9,"one of the worlds most recognised scotch whisky's, glenlivet is a supremely elegant whisky of rewarding and subtle complexity. smoke, clover honey and heather will have you coming back for more time and again.",single malt,700.0,scotland,unknown,0
27,glenmorangie,signet single malt scotch whisky 700ml,214.99,"the culmination of a life-time's experience of glenmorangie's whisky creators, signet is a fusion of some of the oldest and rarest whiskies from the glenmorangie archives aged in designer casks. incredibly smooth, signet tantalises with sizzling spices, before the voluptuous texture of rich chocolate and dark intense aromatic coffee create a veritable velvet explosion of taste. with its iconic, powerful bottle and a statuesque gift box, the stunning packaging visually reflects the beauty of this ultra-stylish and luxurious single malt whisky. with rave reviews by whisky connoisseurs and epicureans alike, this is very limited edition and won't be around for long.",single malt,700.0,scotland,cork,1
28,ardbeg,10 year old scotch whisky 700ml,82.95,"ardbeg 10 year old single malt is typical islay (eye-la). light gold colour with exceptional balance and depth on the nose. the aroma is a beguiling mix of toffee and chocolate sweetness, cinnamon spice, fresh citrus and floral notes of white wine are evident, as are melon, pear drops and a gentle creaminess. there is also fresh phenolics of seaspray and smoked fish. hickory and coffee emerge on the finish.",single malt,700.0,scotland,unknown,0
29,lark,classic cask single malt australian whisky 500ml,164.95,"double-distilled in locally crafted copper-pot stills and aged in carefully selected small casks,  lark classic cask whisky features citrus and butterscotch with a hint of tasmanian peat. a great balance of sweet, spicy and savoury elements make this the perfect dram for whisky-lovers. excellent neat or with a drop or two of filtered water.
nose: golden syrup and vanilla with hints of oranges and grapefruit. plum pudding, christmas cake, cinnamon sticks, nutmeg and a wisp of tasmanian peat smoke.
palate: sweet vanilla transforms into a combination of orange peel, butterscotch, cloves, nutmeg and grapefruit.
finish: butterscotch and citrus notes with a long satisfying smoky finish.",single malt,500.0,australia,cork,1
30,the macallan,rare cask single malt scotch whisky 700ml,399.99,"the rare cask's rich mahogany-red whisky showcases two of the macallan’s greatest and most defining strengths - sherry seasoned oak casks and natural colour. for this spectacular whisky, 16 different cask styles were individually hand chosen for their character, some casks so rare they will never be used again. this spicy quartet is unwavering in flavour. oak resonates, timeless, polished and rich. vanilla and chocolate lead the finale along with a light citrus zest. ending perfectly warming and woody.",single malt,700.0,scotland,unknown,1
31,teeling,24 year old single malt irish whiskey 700ml,600.0,"the teeling 24 year old single malt was first distilled in 1991 and matured in bourbon casks, then allowed marry in sauterne wine casks, allowing for a wholly unique irish whiskey taste experience. bottled at 46% with no chill filtration completing a whiskey of true character.",single malt,700.0,ireland,cork,1
32,oban,14 year old single malt scotch whisky 700ml,109.95,"oban is one of scotland’s oldest and smallest distilleries. it was founded in 1794 and the west highland port town of the same name has grown around the distillery. it is the one single malt scotch whisky in which the rich, complex flavours of the highlands meet and mingle with the peaty, maritime character of the islands. balancing autumn fruits and sea air, oban whisky owes its rich and rewarding highland character to a very long fermentation process. the tiny lamp glass-shaped copper pot stills that make oban’s scotch are among the smallest in scotland, and the liquor they distil is slowly condensed in wooden worm tubs outside among the rooftops, exposed to the salted sea air, bringing a distinct depth of flavour said to go very well with salted caramel.",single malt,700.0,scotland,unknown,1
33,aberlour,a'bunadh single malt scotch whisky 700ml,124.95,"aberlour a'bunadh is a single batch single malt that is sourced exclusively from the speyside region - a'bunadh meaning 'the origin' in gaelic. straight from the cask without chill-filtration and alcohol reduction, this whisky is heavy bodied and jam packed full of flavour. a'bunadh is not for the faint hearted as with each batch they mature it exclusively in spanish oloroso sherry butts. the nose, is simply christmas in a glass. dried dates combined with heavy spices, cloves star anise and cinnamon sticks with burnt orange in the back. the feeling of black cherries with luxury dark chocolate coat the mouth with sherry and oak laced into it. an extremely robust scotch leaves a finish full of exotic spices and wonderful oaky notes.",single malt,700.0,scotland,unknown,1
34,dalwhinnie,15 year old single highland malt scotch whisky 700ml,94.95,"dalwhinnie is the highest of all the distillers in scotland and place so to take advantage of the cleanest springwater possible. dalwhinnie has a smokey, floral aroma and a delicate palate of heather and honed malt. a serious whisky, yet approachable to the beginners.",blended,700.0,scotland,unknown,0
35,the shinobu,10 yr mizunara oak whisky,149.0,"fresh wood barrel dominates the spirit with a touch of vanilla and flowers that bring to breath of nectar, maltose, tones of fruits citrus, mizunara oak & coffee beans; medium wood intergration, then finish with a sweet aftertaste of maltose.

summary: very smooth, rounded full pallet and easy to drink.
 
tasting notes:
colour: mahogany
nose: fresh wood barrel dominates the spirit with a touch of vanilla and flowers and slight honey suckle.
palate: maltose, a little bit tones of fruits citrus, mizunara oak, coffee beans.
finish: woody & back to sweet aftertaste of maltose..",blended,700.0,10 year old,unknown,1
36,bruichladdich,port charlotte 10 year old scotch whisky 700ml,99.95,"this port charlotte 10 year old has been conceived, distilled, matured and bottled on islay alone. a young team with deep-rooted values, and an ambition to make the ultimate “islay” islay whisky. a whisky made by people not software; a whisky watched over every day of its maturing life by those who made it; a whisky born of a community with a vision and a mission to kick start a single malt whisky revolution, this port charlotte 10 year old is who we are.",single malt,700.0,scotland,cork,0
37,the balvenie,portwood 21 year old single malt scotch whisky 700ml,272.99,"classic speyside distillery, balvenie have blended some of their rarest reserve whiskies and aged them for 21 long years. in the final few months of the ageing process, the whisky is transferred to port casks, or pipes, to impart a luscious, creamy and silken character. the whisky is tasted regularly by the balvenie malt master to impart just the perfect amount of flavour to further enhance those honey and spice notes that give way to a long, gentle and nutty finish.",single malt,700.0,scotland,cork,1
38,glen moray,classic port cask single malt scotch whisky 700ml,51.99,this classic port cask scotch whisky is a new addition to the glen moray single malt family. it has the perfect combination of rich wine flavours with vanilla oak notes because it is matured from the finest american oak barrels then matured for another 8 months in port pipes. this whisky is specially selected by the master distiller due to the fact that it is well balanced and full of character.,single malt,700.0,scotland,cork,0
39,the macallan,12 year old sherry cask single malt scotch whisky 700ml,119.99,"the macallan sherry oak 12 year old is matured exclusively in hand-picked sherry seasoned oak casks from jerez, adding richness and complexity. a matured character, the 12 years old delivers rich wood spice and dried fruits and a natural rich gold colour.",single malt,700.0,scotland,cork,1
40,glenfiddich,21 year old single malt scotch whisky 700ml,269.99,"a rich and complex scotch, finished in caribbean rum casks with toffee sweetness, notes of vanilla and hints of new leather. the rum casks give the scotch just the perfect kiss of exotic spice. best enjoyed neat, with a splash of filtered water or over ice.",single malt,700.0,scotland,unknown,1
41,glenfiddich,21 year old single malt lunar new year edition 700ml,269.99,"glenfiddich is the world's most awarded single malt scotch whisky, and this pack is the perfect gift to celebrate lunar new year.

glenfiddich means 'valley of the deer' in scottish gaelic, this is symbolised by the royal stag icon that adorns each whisky. the noble stag is also an ancient symbol of long life, good fortune and prosperity in china.

the illustration adorning this limited edition gift pack depicts the epic journey taken by charles gordon, the son-in-law of the distillery founder, 110 years ago from scotland to asia.",single malt,700.0,scotland,unknown,1
42,the macallan,12 year old double cask single malt scotch whisky 700ml,104.95,"the macallan 12 year old double cask is the perfect balance of 100% sherry seasoned american and european oak, a marriage of 2 wood types. smooth, sweet and balanced. the defining style is american oak - citrus and light oak balanced by the expected macallan character of rich fruit and wood spice.",single malt,700.0,scotland,unknown,1
43,highland park,12 year old scotch whisky 700ml,79.95,the highland style of whisky is generally considered to be one of the most approachable styles. deep gold in colour with a nose of heather and wood smoke highland park has a deceptively complex palate that ranges from sweet maltiness to smokey peat and savoury spices.,blended,700.0,scotland,unknown,0
44,lagavulin,8 year old single malt scotch whisky 700ml,89.95,"lagavulin 8 year old is big and smoky, with sweet spice that becomes apparent with a drop of water. inspired by the visit of alfred barnard to the distillery in the 1880's when he tried an 'exceptionally fine' eight-year-old from the distillery, this is a fitting tribute.",single malt,700.0,scotland,cork,0
45,starward,nova single malt australian whisky 700ml,89.95,"starward nova is uniquely australian, crafted exclusively with local wine barrels for maturation resulting in a whisky with balanced aromas of raisins, bananas and a touch of balsamic lead to clove, toffee and nougat. the palate is filled with red berries, hints of cinnamon and a variety of savoury and spice driven notes. a long, dry and tannic finish guides a strong linear reach through the palate, balancing a generous roundness and oiliness of the spirit.",single malt,700.0,starward,screw cap,0
46,the glenlivet,18 year old single malt scotch whisky 700ml,152.99,"glenlivet is a sherry-finished speyside malt whisky. honey in colour, spiced on the nose and a smoky palate make this a gorgeously luxurious scotch.",single malt,700.0,scotland,unknown,1
47,edradour,10 year old single malt scotch whisky 700ml,73.0,"this scotch whisky is handmade with rich, fruit cake flavours and a sweetness that emerges from the combination of sherry wood and the small stills of our old farm distillery. despite being such a small distillery, edradour produces more whiskies than most other distilleries. owner since 2002, master of the quaich andrew symington has expertly used the spirit from our small stills, matured in the highest quality oak wood, to create a stunning and diverse range of single malts.",single malt,700.0,scotland,cork,0
48,the dalmore,cigar malt reserve single malt scotch whisky 700ml,140.0,"dalmore, located on the northern shores of the firth of cromarty, deep in the scottish highlands has been making single malt whiskies since 1839 and the bottles still bear the stag crest of the clan mackenzie. their cigar malt reserve is a wonderful blend of three different oak types of 10-15 year old whiskies. white american oak, 30 year old matusalem olorosso sherry casks and premier cru cabernet sauvignon wine barriques. the final blend has an enveloping aroma and flavour of the finest hand-made cigars; rich and smoky and extremely long lasting.",single malt,700.0,scotland,cork,1
49,the shinobu,pure malt mizunara oak whisky,114.99,"niigata is known in japan for its “three white” treasures, i.e. snow, rice and sake, and a naturally blessed environment for pure water source. shinobu means “forbearance” in japanese as it is how the distiller’s spirit should be when making quality whisky. shinobu whisky is hand crafted by the creative distiller, mr. usami, by carefully selecting whisky from around the world which are first reserved in ex-sherry and ex-bourbon casks and then finishing them with precious japanese mizunara oak in japan. the result is a unique fusion of flavours and dynamic explosion in palate yet so smooth and easy to drink. all natural with no colouring.
tasting notes
colour: old gold
nose: vanilla, plums, mint
palate: slightly sweet, spices, vanilla, citrus, smoky oak
finish: medium, sweet, woody, minty, slight bitterness",blended,700.0,japan,unknown,1
50,strathmill,25 year old scotch whisky 700ml,398.95,"strathmill 25 year old is a limited edition, natural cask strength single malt. it's light and cheerful as a summer morning. an enigmatic and tantalising nose, well balanced between fresh and over-ripe, leads after a sweet start to an elegant dryness on the complex palate, then a long finish with a lovely aromatic dryness. add water if you wish, but with care.",single malt,700.0,scotland,cork,1
