,name,description,price,product_details,variatal,size,country,closure,target
280,wolfburn,batch 375 single malt scotch whisky 700ml,174.99,"46% abv. wolfburn’s third small-batch release is limited to less than 300 bottles for australia, and what an exceptional wee dram it is. crafted from unpeated spirit, it has been matured for around four years in a combination of half-size, first-fill bourbon barrels (designed for kentucky’s woodford reserve) and second-fill, oloroso sherry hogsheads. thanks to the rapid maturation from the small barrels, the resulting whisky is rich and complex in flavour, with a beautifully sweet and aromatic nose and a lingering finish. 

on the nose you can expect sherry sweetness as well as heather honey and apple blossom. the palate is at first sweet and creamy, with soft bourbon, vanillin notes intertwined with dried fruits, ripe apple, gooseberries and maple syrup all here. the finish lingers on and on, with the honey tones present until the very end. it is a truly beautiful dram.",single malt,700.0,scotland,cork,1
281,ironhouse distillery,tasman whisky - port cask - tasmanian single malt,230.0,"aged 4yrs in portuguese sourced port barrels and re-conditioned in tasmania, our pure tasmanian single malt port cask is an enticing drop. the initial pour sits in the glass with a reddish orange embered hue and greets the nose with a stone fruit, red wine, buttery, sweetened spiced aroma.
a palate of red berried wines, dried dark fruit, orange zest, hazelnut oak warmth with a touch of dark chocolate, tobacco and heat.

this water of life tells a story, hence our tasman whisky is housed within in a gift box worthy of the high quality tomes of old. its sits ready to be shelved as a volume of flavour, truly highlighting our subtle differences the salt air wafting through the distillery brings.

ready to be housed among your collection proudly. 

our story ;

at the edge of the tasman sea, where the old drovers hut iron house once stood watchful, we’ve been carefully crafting our single malt whisky’s over the last 4 years. unleashed and disgorged from the darkened corners of the our bonding room and hand selected by iron house master distiller, michael briggs, you will be treated to a full flavoured experience. 

in an age old tradition we have created our premium range of whisky, our spiritus frumenti, for all to indulge in. tasman whisky is absolutely uncompromising and complex and 100% tasmanian. mindfully distilled within the confines of our copper still, it is the synergy between the purest malts sourced from the north of the state, the pristine waters of and the cleanest ocean air of tasmania’s untainted east coast that balance and mature our spirit perfectly.

good whisky is naught but a lens. it is the drink for celebrating your best days and reflecting thoughtfully on your hardest. it’s a spirit that demands a careful and discerning approach.

it is our story, but it is your whisky.
tasman whisky.

the spirit of the east.",single malt,700.0,australia,unknown,1
282,mars,komagatake 27 year old japanese whisky 700ml,1800.0,"this super limited single malt was carefully vatted from 4 different vintage casks from between 1986 and 1990 at mars shinshu distillery in nagano prefecture where they experience the effects of the cool climate and high altitude. american white oak and sherry casks created great complexity over such a long ageing period. less than 1,800 bottles were produced. it is showing a lovely amber colour, with sweet vanilla and plum notes coming up slowly on the palate. the texture is velvety with floral and nuttiness and hint of spice and gentle peat on an elegant finish.",single malt,700.0,japan,unknown,1
283,jura,prophecy single malt scotch whisky 700ml,134.99,"heavily peated with a sweet and spicy finish.
a complex whisky aged to perfection inside limousin oak casks. some say it tastes of peat smoke with fresh cinnamon and spicy sea spray. but like any great story, it’s open to interpretation.
colour: fiery golden embers
nose: an exquisite burst of bonfire smoke slowly gives way to salty and spicy sea spray
taste: powerful peat smoke and spicy sea spray open up the palate, followed by flavours of soft liquorice, spicy cinnamon and nutmeg.",single malt,700.0,scotland,unknown,1
284,glenfiddich,third edition 50 year old single malt scotch whisky 700ml,48000.0,"vibrant, zesty, vanilla toffee and gentle smoke only the second vatting and one of the oldest, finest whiskies only 50 bottles of this single malt scotch whisky are released each year every bottle is uniquely hand-blown and individually numbered in wax finishing touches are crafted to the bottle in silver presented in a hand-stitched, black leather case accompanied by a certificate of authenticity and details book rare, sought after, historic.",single malt,700.0,scotland,cork,1
285,the singleton,of glen ord 14 year old single malt scotch whisky 700ml,179.99,"the first singleton of glen ord in this series. this 14 year old is given a unique & complicated five cask maturation & marrying process. it has been known by many names over its history; ord, glenordie, ordie, muir of ord & glen ord. a nose of ginger snaps, cocoa & vanilla oak. soft, waxy fruit texture, toffee, subtle stone fruit & gingerbread on the palate. toasty oak & black pepper on the finish.",single malt,700.0,scotland,cork,1
286,spring bay distiller,sherry cask matured single malt whisky,205.0,"whisky: spring bay sherry cask
abv: 46%
tasting notes courtesy of mark nicholson
colour: dark copper
nose: caramel & raisins
palate: lifted floral notes, caramel and dried fruit sweetness with some white
pepper savory hints
finish: delicious long and slightly dry finish which is indicative of some very
fine old wood. a slightly smokey note that suggests peat but comes
from the heavy cask charring",single malt,700.0,australia,cork,1
288,tullibardine,sauternes finish 225 700ml boxed,89.99,"tullibardine’s 225 sauternes finish is a wonderful, rich whisky, matured in first-fill ex-bourbon barrels and finished in 225 litre french château suduiraut sauternes casks.
this beautifully golden tullibardine features hints of citrusy lime on the nose, as well as aromas of vanilla and oatmeal. on the palate, there is a touch of tropical pineapple and zingy orange zest and finishes with a creamy edge.",blended,700.0,scotland,cork,0
289,ladyburn,42 year old single malt scotch whisky 750ml,2250.0,"ladyburn 42 year old is a single malt collectors whisky from the now demolished ladyburn distillery in the lowlands of scotland. the main purpose of the distillery was production of whisky for the blends produced by william grant and sons ltd for brands balvenie and glenfiddich. however, over the decade it was in operation, a handful of 'official' single malt whiskies were bottled as well. this rare whisky is one of them.",single malt,750.0,scotland,cork,1
290,ancnoc,18 year old single malt scotch whisky 700ml,169.99,"the ancnoc 18 year old scotch whisky has matured in spanish oak ex-sherry casks and american oak ex-bourbon barrels and has been bottled in its most natural form, neither chill-filtered nor coloured. as a result this dram may develop a light haze with the addition of water or if kept at a cold temperature. this haze is a natural characteristic of whisky that is non chill-filtered.",single malt,700.0,scotland,stopper,1
291,ledaig,42 year old single malt scotch whisky 700ml,4500.0,"on the palate, the peat is far more prominent, impressively so, but this is still hugely rich with honeyed nuts, treacle and blackcurrant coulis. if you keep it in your mouth, this slowly gives way, delightfully, to chocolate cake made with delicious bitter cocoa and a layer of apricot jam.",single malt,700.0,scotland,cork,1
293,brora,37 year old scotch whisky 700ml,2600.0,"from one of the earliest distilleries in scotland, this is the oldest brora bottled in the series. the whisky is a magnificently confident, smoky and sweet brora to recall shakespeare's timeless description of cleopatra... 'age cannot wither her, nor custom stale her infinite variety’… if a chocolatier made a malt it would surely taste like this, with cocoa-rich shells and centres of caramel, cherry fruit and marzipan offset by a perfectly judged sea-salt piquancy.",blended,700.0,scotland,cork,1
294,glenlossie,10 year old single malt scotch whisky 700ml,99.99,the nose is full of cereal and grist. notes of peels and malt with wood shavings and hay. the palate is of good body with a decent sweetness and plenty of fruit with barley sugar and peppy oak. the finish is long with gristy tannins.,single malt,700.0,scotland,cork,0
295,berry brothers & rudd,auchroisk 2000 scotch whisky 700ml,149.99,"auchroisk distillery, (pron. othrusk), started producing in 1974. a major contributor to some famous blends, it is seldom seen as an independently bottled whisky. the awkward name derives from the gaelic meaning shallow ford across the red stream which relates to the nearby mulben burn and the distillery was for a period, known as the singleton due to the difficulty of pronouncing the original name. this single cask expression has spent 14 years maturing in oak before bottling.",blended,700.0,scotland,cork,1
296,westland,american single malt peated whiskey 700ml,149.99,"the westland american single malt peated whiskey is matured for 24 months in new american oak and first fill ex-bourbon casks, the nose starts off with a nuttiness accompanied by smouldering moss and flamed orange peel. the peat leaps from the palate, expressing campfire notes, iodine, and roasted pistachios. with time, the smouldering moss on the nose evolves into burning embers and roasted plantains.",single malt,700.0,stopper,stopper,1
297,auchroisk,25 year old scotch whisky 700ml,498.95,"the auchroisk scotch whisky 25yo is a limited edition, natural cask strength single malt.an  a fruity apéritif malt, at its best with a little water; enjoyable at the start of an evening and indeed at other times too. gloriously fresh and fruity, with a light body and good structure; the initially clean nose gives little hint of the spicy flavours of fruit that follow.",single malt,700.0,scotland,unknown,1
298,bowmore,small batch scotch whisky 700ml,81.99,"bowmore small batch scotch whisky has a beautiful balance between sweet & savoury. the nose is full of vanilla fudge, fresh sea air and peaty smoke followed by a mouth-watering palate of citrus, vanilla & cinnamon all leading to a superb finish.",blended,700.0,scotland,cork,0
299,cragganmore,25 year old single malt scotch whisky 700ml,550.0,"cragganmore 25 year old scotch whisky is a limited edition, natural cask strength single malt. a complex wonderful balance between sweet and dry. a splendidly mature, serious and intriguing whisky full of exciting and evocative aromas and flavours, which has a depth and elegant structure worthy of any study; adding water softens things yet also dulls this fabulous complexity.",single malt,700.0,scotland,cork,1
300,glengoyne,25 year old scotch whisky 700ml,600.0,"straddling the scottish high and lowlands, glengoyne have scotland's slowest whisky distillation process. the result, unique and exceptional single malts. add to this 25 years maturing in hand selected european oak sherry casks and you have an unmissable whisky experience.",single malt,700.0,scotland,cork,1
301,gordon & macphail,connoisseurs choice bladnoch 1993 scotch whisky 700ml,269.99,"a lowland malt on the traffic route to the ferries sailing to ireland. closed for a few years but now back in production. nose it to find fresh herbal notes, mint and some subtle malty aromas, developing to hints of exotic fruit. later, defined peach and a delicate touch of fresh hay. a mouth warming palate, with a touch of mustard powder. creamy and sweet, with rounded fruity influences developing. keep going and you may find spice and some hazelnuts. a delicate, sweet and fresh style with a long finish.",blended,700.0,scotland,cork,1
302,loch lomond,18 year old single malt scotch whisky 700ml,129.9,"loch lomond 18 year old is a fine single malt whisky produced in the scottish highlands using knowledge gained over nearly 200 years. aged in old oak casks for more than 18 years, it is bottled at the peak of perfection. you can discover a wonderful nose of pear and honey and a fruity taste combined with smooth toffee. the delightful finish is dry and oaky.",single malt,700.0,scotland,cork,1
303,glen moray,mastery single malt scotch whisky 700ml,1400.0,"in celebration of glen moray's 120th anniversary, the distillery released the limited edition glen moray mastery. crafted by their master distiller graham coull, this single malt was made using five different vintages of their whisky, with only 1,000 bottles produced.",single malt,700.0,scotland,unknown,1
304,benromach,sassicaia 2009 speyside single malt scotch whisky 700ml,129.99,"lovingly nurtured in sassicaia wine casks, our limited-edition single malt wood finish is brimming with luscious fruitiness and a subtle smoky edge. this beautiful benromach wood finish is matured in first fill bourbon barrels, followed by 28 months in sassicaia casks from the fashionable wine-producing region of bolgheri in tuscany.",single malt,700.0,scotland,stopper,1
305,glencadam,17 year old single malt scotch whisky 700ml,239.99,"colour: stunning rosé pink hue
nose: toffee and plum sweetness is softly swathed in vanilla and sumptuous malt
palate: lush sweet malt, plums and prunes swirl as one with summer fruits, vanilla and toffee
finish: abundantly porty-sweetness yields to a spicy finale",single malt,700.0,scotland,screw cap,1
306,scapa,glansa single malt scotch whisky 700ml,129.99,"taking our signature smooth fruity single malt, which is aged in american oak, this expression is then rested in peated casks creating richness and depth, with notes of warm, heather-honey and soft fruits giving way to a subtle smoky finish.",single malt,700.0,scotland,unknown,1
307,oban,21 year old single malt whisky 700ml,825.0,"a very special and rare extra-mature oban, unusually matured in refill european oak butts, that’s quite ethereal and especially maritime in nature. oban is a little gem of a distillery founded in 1794, which predates the town that grew around it. this is one of scotland’s smallest distilleries, so small that there is no room for the worm tubs next to the still house (they nestle in the rooftops), and the stills themselves are tiny. it once almost fell victim to its size – its closure was
announced in 1968 because it was so small, but fortunately a reprieve was granted. not only is this a small distillery making what was once called “the finest sma’ still whisky in the highlands”, it is one in which the stills do not run continuously; judicious rest is needed to maintain the light, fruity and spicy character of their spirit. this contributes to its small annual production and the special rarity of older releases",single malt,700.0,scotland,unknown,1
308,launceston,single malt whisky bourbon cask 500ml,155.99,"drawing from twelve small american oak casks; a light engaging whisky with fragrant aromas, double distilled and non-chill filtered to retain depth of character.

 

colour rich dark gold.

nose bright fragrant aromas with hints of vanilla, honey and pears.

taste a soft mouthfeel with subtle sweet bourbon notes, vanilla, honey and green fruit.

finish a pleasant, smooth and lingering finish.

 

the distillery at hangar 17

launceston distillery produce hand-crafted, small-batch whisky. using traditional techniques and craftsmanship, head distiller chris condon uses tasmanian malted barley and pure river water to produce the finest quality single malt whisky.

from grain to bottle everything happens under the roof of hangar 17, neighbouring launceston airport.",single malt,500.0,australia,cork,1
309,ironhouse distillery,tasman whisky - bourbon cask - tasmanian single malt,230.0,"aged 4yrs in american oak ex makers mark barrels, our single malt bourbon cask brings rum and raisin aromas with a subtle vanilla and a spiced herb oak undertone. a wash of buttery warm caramels heat, hazelnut and oak finish with sweet dried fruits to engulf the palate, with a lengthy finish of bourbon heat and spiced oils.

this water of life tells a story, hence our tasman whisky is housed within in a gift box worthy of the high quality tomes of old. its sits ready to be shelved as a volume of flavour, truly highlighting our subtle differences the salt air wafting through the distillery brings.

ready to be housed among your collection proudly. 

at the edge of the tasman sea, where the old drovers hut iron house once stood watchful, we’ve been carefully crafting our single malt whisky’s over the last 4 years. unleashed and disgorged from the darkened corners of the our bonding room and hand selected by iron house master distiller, michael briggs, you will be treated to a full flavoured experience. 

in an age old tradition we have created our premium range of whisky, our spiritus frumenti, for all to indulge in. tasman whisky is absolutely uncompromising and complex and 100% tasmanian. mindfully distilled within the confines of our copper still, it is the synergy between the purest malts sourced from the north of the state, the pristine waters of and the cleanest ocean air of tasmania’s untainted east coast that balance and mature our spirit perfectly.

good whisky is naught but a lens. it is the drink for celebrating your best days and reflecting thoughtfully on your hardest. it’s a spirit that demands a careful and discerning approach.

it is our story, but it is your whisky.
tasman whisky.

the spirit of the east.",single malt,700.0,australia,unknown,1
310,glenglassaugh,40 year old deluxe,3500.0,"glenglassaugh 40 years old, specially selected by master distiller billy walker, is an outstanding representation of this rare and enduring highland single malt. matured for over 40 years, this rich whisky has an abundance of of sweet tropical fruits and sophisticated sherry characters. bottled at 42.5%, non chill filtered and at natural colour, this unique expression is full of character and complexity.

colour: deep gold.

nose: an abundance of sweet syrupy tropical fruits; banana, pineapple and mango in perfect harmony with gentle oloroso sherry.

palate: sweet, rich, syrupy and complex. oloroso sherry, toffee apples, mango and banana sit beautifully in the mouth alongside ginger and cocoa spice.

finish: rich, spiced sherry.",single malt,700.0,scotland,unknown,1
311,corowa,corowa distilling co. quick’s courage single malt 46% 500 ml,175.0,"corowa distilling co. quick’s courage single malt 46% 500 ml

the 7th release from corowa distilling co, quick’s courage expression is the first “federation reserve” release from corowa distilling co. it takes its name from john quick, an english-born australian lawyer, politician and author who was the federal member of parliament for bendigo from 1901 to 1913 and a leading delegate to the constitutional conventions in the 1890s.

it is arguably the most ‘mature’ of the corowa so far with total of 600 bottles released. it was first matured in american oak bourbon barrels before being transferred in ex-pedro ximenez sherry barrels for the sherry influence with sweeter toffee and vanilla notes.",single malt,500.0,wales,screw cap,1
312,bladnoch,bicentennial release 29 year old single malt scotch whisky,8800.0,"the bladnoch bicentennial release has been matured for 29 years in oloroso sherry casks and finished in moscatel casks for a final 18 months. only 200 bottles were made to celebrate 200 years, making this an extremely rare release.
  colour: chestnut gold.
nose: lovely rich old sherry aromas, acacia, honey, beeswax, orange, fruitcake, a whiff of coffee and a hint of chocolate.
palate: soft and silky sherry flavours. dark chocolate, ginger, spicy citrus notes, balanced oak and a hint of ground black pepper.
finish: warming with a hint of honeyed spiciness. satisfying and long.",single malt,700.0,scotland,cork,1
313,fannys bay,barrel 50 bourbon whisky 500ml,294.99,"each barrel whether it's port aged, pinot aged, sherry aged, shiraz aged or bourbon aged, only has between 30 – 40 bottles. we also flock (another word for dilute) some of our barrels, which means we have “flocked strength” or cask strength, so the difference is the strength (alcohol by volume).

notes of subtle bourbon, honey and apple.

please note each bottle changes with new barrels so the image is just an example of the bottle.",blended,500.0,australia,cork,1
314,kilchoman,2018 port cask single malt scotch whisky 700ml,184.99,"nose: red fruits with light citrus, earthy peat smoke and hints of creamy sweetness.
palate: redcurrant jam, cinnamon with layers of citrus, floral sweetness and coastal influence.
finish: layers of cooked red fruits.",single malt,700.0,scotland,cork,1
315,the balvenie,40yo single barrel single malt scotch whisky 700ml,6000.0,"rich oak notes shaped this forty year old masterpiece from balvenie. malt master david stewart has skilfully married together small amounts of scotch whisky matured in 4 refill hogsheads and 3 sherry butts that have lain in the warehouses for at least forty years. resulting in baked apple, stewed fruits like characters with soft leather. a silky smooth texture with a beautifully coating in the mouth. sensational.",single malt,700.0,scotland,cork,1
316,gordon & macphail,15 year old single malt scotch whisky 700ml,169.99,"made at linkwood distillery, this speyside single malt has been matured for 15 years, before being bottled in 2019 by gordon & macphail for its distillery labels series.",single malt,700.0,scotland,cork,1
317,tullibardine,sovereign 700ml boxed,82.99,"tullibardine sovereign signature single malt has been matured in first-fill ex-bourbon barrels.
tullibardine sovereign is beautifully golden with floral, sweet barley notes and subtle hints of vanilla. on the finish, there is fudge, pear drops and soft spice.",single malt,700.0,scotland,cork,0
318,craoi na mona,10 year old irish whiskey 700ml,129.99,"after maturing for 10 years in ireland in american oak casks, the irish single malt is shipped over to scotland where it spends a few short months in casks that had previously matured heavily peated islay malt (laphroaig). these casks, though emptied, still retained a huge smokiness which is carried over.",single malt,700.0,ireland,cork,1
319,port askaig,8 year old single malt scotch whisky 700ml,109.99,"delicate sweetness of salted caramel, liquorice, with waves of dark, coastal peat smoke building beneath. port askaig is a range of islay single malt whiskies that embodies the unique spirit of islay and its people. its character brings together the robust smokiness and soft fruitiness found in this beguiling island. the range has been developed to appeal to the most discerning of whisky connoisseurs while also appealing to the novice whisky drinker. port askaig have selected exceptional casks of islay single malt to create a range recognised as islay classics.",single malt,700.0,scotland,stopper,1
320,glenmorangie,1991 single malt scotch whisky 700ml,950.0,"two profoundly different whiskies married in implausible harmony, create the rich, plum taste of glenmorangie grand vintage malt 1991. aged for 26 years, the fourth release in our exclusive bond house no. 1 collection owes its fruity depths to two rare parcels of 1991 whisky which, ordinarily, would never be brought together. long matured in bourbon casks, each was then finished for more than a decade – one in oloroso sherry casks for sweetness and spice, the other in burgundy casks for earthy and truffle notes. at first, their characters seem utterly incongruous. yet, skilfully softened with a hint of whisky aged in new toasted oak, those contrasts unite in a limited-edition single malt whisky astonishingly mellow and deep.",single malt,700.0,scotland,stopper,1
321,gordon & macphail,connoisseurs choice benriach 1997 scotch whisky 700ml,169.99,"benriach is located on the same site as longmorn near elgin at the top of the spey valley. originally owned by the grant family, then seagrams but now in independent hands. it is a pale golden colour with a nose of subtle sherry, herbs and some almond. a little water will bring out cracked pepper and marzipan. in the mouth, pepper, toffee, brazil nut, berries and may even remind you of ice-cream soda with a sweet creamy finish. a light and subtle aperitif dram with a fruity finish.",blended,700.0,scotland,cork,1
322,teaninich,10 year old single malt scotch whisky 700ml,99.99,"the nose is quite frgrant with fruit and a greenness. notes of cut hay and chamomile, hints of wood resins and potpourri with a little winter spice and a gentle citric acidity. the palate is of medium-body with a pleasant dryness. there are notes of barley sugars and cereal notes. there are some oily herbal notes with more of that citric acidity developing with a hint of espresso. the finish is quite dry and of medium-length with its gentle cut grasses.",single malt,700.0,scotland,cork,0
323,the macallan,reflexion single malt scotch whisky 700ml,2000.0,"this exceptional single malt draws its colour and flavour from maturation in smaller hogshead casks, allowing a greater surface area of wood to interact with the whisky to deliver an intricate character influenced by both spanish and american oak casks. the depth of colour and complex flavour of reflexion is derived from the use of first-fill casks, carefully selected for this distinctive expression to accentuate its aromas and flavours. bold and full bodied, reflexion is a celebration of floral and vanilla notes, punctuated with fresh apples and apricots.",single malt,700.0,scotland,unknown,1
