,name,description,price,product_details,variatal,size,country,closure,target
97,limeburners,infinity solera cask single malt whisky 700ml,143.99,"matured in port puncheons, limeburners whisky is aged for up to 8 years. the resulting single malt is all spice and fruit with aromas of port and vanilla on the nose, barley, honey, raisins and caramel on the palate and finishes smooth.",single malt,700.0,western australia,unknown,1
98,the balvenie,'thirty' 30 year old scotch whisky 700ml,1290.0,"the balvenie 'thirty' is a rare and fine single malt scotch that has been crafted from specially selected barrels by malt master, david stewart. by marrying balvenie, slowly aged in traditional oak whisky casks with european oak sherry casks, david stewart creates a rich, silky smooth honeyed scotch whisky. the nose has mellow oaky tones and hints of candied orange peel giving a taste of great depth with rich dark chocolate, hints of plum, marzipan and caramelised pear. 'thirty' is bottled at 47.3% abv to capture all the signature characteristics of the balvenie.",single malt,700.0,scotland,cork,1
99,laphroaig,triple wood scotch whisky 700ml,124.95,"laphroaig triple wood has enjoyed a triple maturation in 3 types of cask. the first maturation in american oak, ex-bourbon barrels, and then transferred into small 19th century style quarter casks for a second maturation. the final maturation is in specially selected, large european oak, oloroso sherry casks. the result is a wonderfully rich and powerful islay single malt.",single malt,700.0,scotland,cork,1
100,the glenrothes,18 year old single malt scotch whisky 700ml,209.99,"the soleo collection is a new range with clear story and navigation, moving away from vintages and focusing on age statements. all expressions are matured in 100% sherry seasoned casks, for a rich sensorial experience. no allocation constraints. the glenrothes 18 years old is a complex and well rounded expression, perfect for after dinner or to compliment fine chocolate and artisan cheese",single malt,700.0,scotland,stopper,1
101,caol ila,12 year old scotch whisky 700ml,103.99,"fresh, sweetly fruity and smooth-bodied, caol ila 12 yo single malt scotch whisky delicately balances a range of tastes. the clean, appetising nose shows subtle citrus fruit with just a puff of smoke. firm and smooth, it begins sweetly then yields a fragrant smokiness and a sweet-smoky, lingering finish.",single malt,700.0,scotland,cork,1
102,glenallachie,12 year old single malt scotch whisky 700ml,109.99,"we would like to introduce the most important release in the history of the glenallachie distillers company; glenallachie 12 year old, the heart of our range, a landmark bottling. our best casks selected and bottled under the careful eye of our master distiller billy walker. flavours of honey, marzipan and bananas, with lashings of butterscotch, raisins and a delicate hint of mocha.",single malt,700.0,scotland,cork,1
103,bowmore,12 year old scotch whisky 700ml,91.99,"located in islay’s capital of the same name, bowmore uses a combination of dedicated craftsmen, pure water, smoked peat and traditional manufacturing techniques to ensure that their whisky tastes the same as it did when it was first distilled in 1779. the 12 year old single malt has a nose of lifted lemon and honey that are bound together with the distinctive bowmore smokiness. on the palate, the whisky is warm and delicious with subtle dark chocolate and peat smoke.",single malt,700.0,scotland,unknown,0
104,bruichladdich,octomore 09.1 scotch whisky 700ml,219.99,"octomore 09.1 questions the fundamentals of superior single malt scotch. confident in its five year age statement, our head distiller demonstrates how a focus on raw ingredients and considered distillation can definitively debunk the myth that older is better. distilled in 2012 from 100% scottish barley, the 09.1 is matured full-term in top-tier ex-american whiskey casks. ",single malt,700.0,scotland,cork,1
105,writers tears,redhead irish whiskey 700ml,92.99,"this exquisite, triple-distilled single malt irish whiskey is matured only in select handpicked spanish sherry casks which have previously been seasoned with the finest oloroso sherry. it is the influence of these scarce casks that give this expression of writers tears its signature rich, ruby hue and hence the name - 'red head'. the expression is distilled without chill filtering as nature intended and at a distinctive 46% abv.",single malt,700.0,ireland,unknown,0
106,bruichladdich,black art edition 6 whisky 700ml,550.0,"a cryptic composition of casks, the legendary bruichladdich black art reaches its sixth edition. this unpeated single malt has undergone a parallel journey with our head distiller, adam. having worked closely with these casks in his early days in the warehouses, under the guidance of then master distiller jim mcewan, adam has had the honour of learning and developing alongside this spirit. the substantial task of hand-selecting and blending our very best spirit now falls to him alone.",single malt,700.0,scotland,unknown,1
107,the arran,malt the bothy scotch whisky 700ml,99.95,"the bothy is a limited edition of the arran malt which pays homage to the use of small casks which would have played a large part in the arran whisky trade in the 18th & 19th centuries. limited edition of 12,000 bottles worldwide. bottled at natural cask strength 55.7% abv. matured in first-fill ex-bourbon barrels before being transferred for secondary maturation into smaller casks also made of the finest american oak. non chill filtered & no artificial colouring.",blended,700.0,scotland,cork,0
108,"kura, kujira",japanese single malts set,1025.0,"you have an opportunity to try all the finest japanese single malts.
the set includes 1 bottle of each:
- kura white oak japanese single malt 8 years old 720ml
- kura white oak japanese single malt 12 years old 720ml
- kujira ryukyu japanese single malt whisky 20 years old 700ml",single malt,750.0,japan,screw cap,1
109,limeburners,darkest winter single malt whisky 700ml,339.99,"this single malt whisky uses peat collected by hand from the deepest darkest parts of the valley of the giants in wa. the barley was smoked for an extended period, resulting in a heavier, more intense style of whisky ideally suited for darkest winter. this whisky was matured in an ex-bourbon american oak cask. exhibits spice and floral aromas when neat and a splash of water unleashes malted barley and intense complex smokey aromas.",single malt,700.0,australia,unknown,1
110,nant,tasmanian sherry cask whisky 500ml,169.99,"matured in ex-apera (australian sherry-style) casks from south australia this expression offers an intriguing balance of sweet and spice that takes plenty of influence from its cask. nant sherry cask has rich maple aromas complemented by hints of hazelnuts, almonds and spice. as smooth as it is balanced with a dry oak tone, with hints of orange toffee and heated dried fruits and a medium nut and coffee finish.",blended,500.0,australia,unknown,1
111,auchentoshan,three wood scotch whisky 700ml,92.99,"matured in american bourbon oak and finished in spanish olorosso and pedro ximenez casks. a lowland single malt whisky rich with dark fruits, thick butterscotch, roasted hazelnuts and the signature smooth delicate auchentoshan taste.",single malt,700.0,scotland,cork,0
112,glengoyne,18 year old single malt scotch whisky 700ml,164.95,"full bodied, round and rich. at first macerated fruits, marzipan and walnuts; then warm spices, dry cocoa and lingering seville marmalade. spicy vanilla fruit, ripe apples and a rich, luxurious mouthfeel. this is the result of eighteen long years and a generous proportion of first-fill sherry casks.",single malt,700.0,scotland,unknown,1
113,starward,single malt australian whisky 700ml,114.99,"utilising centuries of knowledge and tradition, yet not restricted by it, starward is the brainchild of david vitale who set out to harness the very best of australia's barley, barrels and climate to create the ultimate new world whisky. years of experimentation, adjustment, trial and even more adjustment has created starward, a whisky that will challenge your perceptions of what whisky can be. artisan victorian barley is sourced to begin the bespoke process which ends up in aged australian apera casks that have been re-coopered, re-toasted and re-sized. all of which help create a whisky of smoothness, sweetness and unparalleled complexity.",single malt,700.0,starward,cork,1
114,glen moray,30 year old single malt scotch whisky 700ml,500.0,"a limited edition of glen moray 30 year old double matured selected from the finest american oak barrels and finished sherry casks. antique gold in colour, it has a smooth elegant nose of soft oak and dried fruits. it tastes of well-balanced oak meeting dark chocolate and subtle spice with a lingering and memorable finish.",single malt,700.0,scotland,cork,1
115,craigellachie,13 year old single malt scotch whisky 700ml,99.99,"deemed the bad boy of speyside, craigellachie is an unapologetically unique and challenging single malt. this is a complex dram, packed with flavour and texture.",single malt,700.0,scotland,cork,0
116,connemara,irish whiskey 700ml,79.95,"inspired by the ancient irish distilling traditions, connemara is a peated single malt whiskey which is smooth in the traditional irish style but more complex with the distinct peaty taste of an islay whiskey.",single malt,700.0,ireland,cork,0
117,smokehead,scotch whisky 700ml,68.99,"if you like your scotch whisky with big, vigorous and robust aromas and flavours of peat and smoke, smokehead is your single malt. the flavour is fresh, fruity and immense, with notes of sherry, iodine, toffee, smoke and sea salt all fighting for recognition. a single malt not for the faint of heart!",single malt,700.0,scotland,cork,0
118,craigellachie,17 year old single malt scotch whisky 700ml,179.99,"opening up with aromas such as ripe pineapple and custard creams followed by a meatiness that soon shines through. the delightful tropical fruits have intensified by the extra four years in barrel. there is more smokiness on the palate than the nose, with a touch of clove and oak towards the finish. enjoy neat or on the rocks.",single malt,700.0,scotland,screw cap,1
119,the dalmore,18 year old scotch whisky 700ml,219.99,"the dalmore 12 year old scotch whisky has rich spicy flavour with a much more intense finish on the house style. it is aged for 14 years in american oak, followed by three years in matusalem sherry butts, before a final year in sherry butts. a fantastic nose of vanilla, dark chocolate, citrus fruit, cinnamon, rich coffee, nutmeg and cloves.",blended,700.0,scotland,cork,1
120,old kempton distillery,small cask matured whisky,219.95,"old kempton distillery's small cask matured single malt whisky is hand crafted on a magnificent heritage-listed property in kempton, tasmania, first gazetted to sell spirits in 1836. weary travellers would stop at the coaching inn overnight on their ride between northern and southern tasmania and the local innkeeper would revive them with aq good dram. today, the tradition continues with tasmanian barley double distilled through our copper pot stills and patiently matured in small oak casks, creating delicious, rich, balanced tasmanian single malt whisky - the perfect small cask matured dram. ",single malt,500.0,australia,cork,1
121,glen grant,the major's reserve single malt scotch whisky 700ml,49.95,"now considered one of the most popular malts available, the major's reserve is a brilliant introduction to the world of single malts. beautifully restrained and elegant, yet balanced with a underlying power and persistence of flavour. speyside truly comes alive in the malts of glen grant.",single malt,700.0,scotland,screw cap,0
122,cotswolds,cotswolds odyssey barley single malt whisky 46% 700ml,119.8,"cotswolds single malt whisky is finally out of the cask and into the bottle.
the first whisky ever distilled in the cotswolds, it uses 100% locally grown, floor-malted barley.
matured in first-fill kentucky ex-bourbon barrels and reconditioned american oak 225l red wine casks that had been shaved, toasted and re-charred.
rich, fruity and sippable.",single malt,700.0,england,cork,1
123,rampur,indian single malt 43%,99.99,"rampur is an indian single malt whisky, hand-crafted and aged in the foothills of the himalayas. styled as “the kohinoor of single malts”, this super premium malt whisky is steeped in the rich indian heritage and enduring traditions of the maharajas.",single malt,700.0,cheese,cork,0
124,ailsa bay,single malt scotch whisky 700ml,99.99,"ailsa bay sweet smoke is a single malt distilled with craft, refined with code. created by our progressive and talented team of chemists in one of the most high-tech distilleries in the world, it is scientifically distilled at 022 parts peat, 019 parts sweet then micro matured for a precise balance of sweet and smoky notes.",single malt,700.0,scotland,cork,0
125,the macallan,10 year old single malt scotch whisky 700ml,199.99,the macallan fine oak 10 years old forms part of the fine oak range and is matured for a minimum of ten years in three exceptional oak cask types. this complex combination of casks delivers a light whisky with notes of honey and fruit.,single malt,700.0,scotland,cork,1
126,ledaig,10 year old scotch whisky 700ml,84.95,"ledaig is a wonderfully distinguished single malt handcrafted on the isle of mull by the tobermory distillery. the only distillery on the island, tobermory produces its only peated malt in this ledaig 10 year old single malt. sitting in the ancient vaults for 10 years and the use of superior oak wood casks, aromatic lochan water and the exclusively peat dried malted barley all go to producing a whisky of purity, power and vibrancy. the flavours and aromatics produced can't help but bring you to the ocean side on the isle of mull with their floral and smoky tones. non-chill filtered at 46.3%, ledaig 10 year old will delight all true whisky drinkers.",single malt,700.0,scotland,screw cap,0
127,the glenrothes,12 year old single malt scotch whisky 700ml,97.99,"the soleo collection is a new range with clear story and navigation, moving away from vintages and focusing on age statements. all expressions are matured in 100% sherry seasoned casks, for a rich sensorial experience. no allocation constraints. the glenrothes 12 years old is the classic house style of the glenrothes – fruity and sweet. the glenrothes 12 years old was awarded a score of 93 at the ultimate spirits ",single malt,700.0,scotland,stopper,0
128,teeling,single malt irish whiskey 700ml,85.99,"to add a unique depth of character and flavour, teeling single malt consists of aged malt whiskey up to 23 years old that has been matured in five different wine casks including sherry, port, madeira, white burgundy and cabernet sauvignon. this combination of cask maturation techniques has never been done before in irish whiskey and creates a truly innovative irish whiskey bursting with personality. like all the teeling whiskeys, it's bottled at 46% with no chill filtration, allowing for all the natural flavours of the whiskey to be retained.",single malt,700.0,ireland,cork,0
129,bunnahabhain,stiuireadair single malt scotch whisky 700ml,84.99,"stiùireadair (pronounced ‘stew-rahdur’) means ‘helmsman’ in scots gaelic. this single malt is complex with a rich sherry influence and aromas of fruit, nuts and spice.",single malt,700.0,scotland,screw cap,0
130,glen moray,25yo port cask finish single malt scotch whisky 700ml,379.99,"with less than 3,500 bottles produced for each edition, this special malt is destined to be snapped up by all the true scotch whisky aficionados. each bottle of glen moray's 25 year old port cask finish is hand signed by master distiller graham coull and features the year it was distilled in. this exceptional 25 year old spent the last part of its maturation in authentic port casks from portugal resulting is a malt with a nose that is sweet, rich and complex. the palate follows with notes of toffee apple sweetness and rush of spice on the finish.",single malt,700.0,scotland,cork,1
131,old pulteney,12 year old scotch whisky 700ml,79.95,"old pulteney continue to hold onto traditions that have long since faded in the memory banks of most malt masters in scotland. this adherence to tradition along with the use of the finest malt whisky ingredients allow old pulteney to claim to have some of the finest whiskies in the highlands. matured in ex-bourbon casks, old pulteney 12 year old is the definitive expression in the old pulteney family.",blended,700.0,scotland,unknown,0
132,dailuaine,34 year old scotch whisky 700ml,750.0,"by a dozen years this the oldest bottling ever to come from the original distillers. the whisky is an outstanding and unusually fragrant example of this robust classic that has an unexpected spicy complexity: beautifully balanced, structured and focused, both at cask strength and when smoothed out with water, it's precise, with a clean, well-shaped nose, and is delightfully rich yet also drying in palate and finish.",blended,700.0,scotland,cork,1
133,the benriach,10 year old single malt scotch whisky 700ml,79.95,"bottled at 43% vol, the benriach 10 years old is classic speyside in character. this fresh, lively, fruit-laden single malt captures warm oak spices, green apple, dried apricots, peach and banana with subtle touches of aniseed, lemon zest and barley. warm toasted oak spices flood through green apple skins and dried apricots, ripening to hints of peach and soft banana. subtle touches of aniseed and lemon zest create a contrasting edge to the fruit and add an intriguing character to the long, crisp barley finish.",single malt,700.0,scotland,cork,0
134,bruichladdich,islay barley scotch whisky 700ml,109.99,"bruichladdich's islay barley is the ultimate expression of provenance: single malt, single barley variety, single harvest and even a single field! islay barley is unpeated for maximum barley flavour, non-chill filtered and colouring free. the whisky is matured in american oak casks that are located in bruichladdich's coldest warehouse. this is a fascinating exploration of the +terroir+ of single malt whisky.",single malt,700.0,scotland,cork,1
135,laphroaig,25 year old scotch whisky 2013 edition 700ml,700.0,"remarkable things happen when the world’s most individual malt matures for a quarter of a century. with part of this slumber taking place in fine oloroso sherry casks - friends of laphraoig will find our signature islay peat complemented with aromas of sweet apricot, red apples and dark chocolate which develop into rich flavours of sherry and vanilla in this sweet, soft and dry taste. the 2013 edition of laphroaig 25 year old is a most unique malt whisky - bottled at cask strength and non-chill filtered to add further depth and complexity.",blended,700.0,scotland,cork,1
136,kilchoman,sanaig single islay malt scotch whisky 700ml,119.99,"the kilchoman sanaig single islay malt scotch whisky presents soft cooked fruits with caramel and vanilla on the nose along with toffee, peat smoke and a lingering sweetness on the palate. the finish is a lovely balance of peat smoke, fruit and sweetness.",blended,700.0,scotland,cork,1
137,g. rozelieures,single malt french whisky 700ml,61.99,"founded in 1890 by michel grallet, the rozelieures distillery is located in a small village in the lorraine region in the north-east of france, well know for the quality of the ‘eaux de vie’ produced there. this whisky is created through a traditional process of double distillation using lightly peated malts, resulting in distinctive toasty notes. it is matured in ex- sherry casks that make the whisky soft, elegant and fruity, revealing delicate spicy undertones.",single malt,700.0,g. rozelieures,cork,0
138,jura,10 year old single malt scotch whisky 700ml,79.95,a rich and rounded balance of subtle smoky notes with a sweet sherry cask finish.,single malt,700.0,scotland,unknown,0
139,ledaig,18 year old scotch whisky 700ml,174.95,"this 18 year old ledaig represents the rebirth of the style of malt whisky that would have originally been produced at the distillery. in 1996, master distiller, ian macmillan, inspired by the traditional style of single malts scotch whisky that would have been originally distilled on the island of mull , started distilling ledaig for the first time since the distillery re-opened after it’s final quiet period in 1990. the result is a wonderfully smoky island single malt scotch whisky which balances sweet and floral aromas with the richness and warmth of sea salt and smoke.",single malt,700.0,scotland,stopper,1
140,mortlach,the wee witchie 12 year old single malt scotch whisky 750ml,99.99,"since 1896 all mortlach whiskies have been 2.81 distilled. unlike with any other whisky, our spirit criss-crosses between six copper stills of completely different silhouettes 0.81 more times than is scotch tradition. it is an exact science graced with a touch of magic from “the wee witchie”.

“the wee witchie” is the smallest of our six stills. since it was first forged more than 120 years ago we have fastidiously ensured every dent and detail remains unchanged because it is within this copper chamber that the specific richness of taste which has earned mortlach the reputation as “the beast of dufftown” is created.

we dedicate this 12 year old single malt scotch whisky to the still that bears the beast. it has been double cask matured in both european and american oak to enhance the distinctively rich and robust character that makes mortlach whiskies legendary.",single malt,750.0,scotland,cork,0
141,23rd street distillery,single malt whisky 700ml,149.95,"our much-anticipated first all-australian whisky release. this confident little upstart was sent to time-out in ex-bourbon barrels until our master distiller gave it the golden seal of approval. mature, yet still assertive. luxurious dried fig and cedar aromas precede a palate of citrus peel, warm toffee and buttery length.",single malt,700.0,23rd street distillery,cork,1
143,glengoyne,15 year old single malt scotch whisky 700ml,117.99,"glengoyne can claim to have the slowest distillation process in scotland - a process that makes this distillery very unique, much like their positioning on the highland/lowland border. the 15 year old single malt is supremely complex, sweet and well rounded. there is a wonderful spicy oak finish that compliments the luscious palate that is enhanced by the process of air drying the barley, never peat dried. the hand-selected ex sherry casks also provide a richness that continues into the finish of this fine whisky that is ideally suited to enjoying neat.",single malt,700.0,scotland,cork,1
144,benromach,10 year old single malt scotch whisky 700ml,74.88,"every batch maturation is 80% bourbon barrel and 20% sherry cask, married together for the final year in a first fill oloroso sherry cask. a rich sherry and fruit nose, find the hint of nutty chocolate. taste it, roll it around your mouth. a bit of malt biscuit and very light smoke. a succulent mouth filling balance that lingers.",single malt,700.0,scotland,cork,0
145,overeem,cask strength single malt whisky 700ml,274.99,"on the eye: deep gold & brassy on the nose: intense aromatics, fruit chocolates, caramel, butterscotch, turkish delight, crème brulee, plum pudding rum soaked raisins, hint of cider on the palate: creamy texture, sweet and delicately spicy, fruitcake, caramel, liquorice & sweet malt. the finish: long. vanilla bean laced with spiced raisins.",single malt,700.0,australia,cork,1
146,benromach,peat smoke single malt scotch whisky 700ml,90.88,"this is a seriously smoky whisky. it's speyside peat, peaty but without the iodine tinge that most islay peat gives. one the nose, vanilla, honey and cured meat. a bit of lemon and slight tobacco, even sugared almonds. in the mouth, cracked pepper, aniseed and even a hint of orange with cooked apple and pear emerge. the finish however is smoky, just like sitting around a camp fire.",single malt,700.0,scotland,cork,0
147,glen moray,15 year old single malt scotch whisky 700ml,77.99,glen moray 15 year old whisky is made using an amalgamation of two distinct cask styles - sherry and american oak. an exquisitely complex whisky with a hint of spice and delicate smoke that boasts heady dried fruits and rich dark chocolate.,single malt,700.0,scotland,cork,0
148,balcones distilling,texas single malt whisky,134.99,"a timeless style of malt whisky, balcones “1” texas single malt breathes new life into centuries of distilling tradition with classic techniques and ingredients adapted for new world tastes. opening aromas bear hints of toffee and overripe fruits. on the palate, layers of toasted malt and honey give way to mellow notes of baked pears and apples. a long finish is accompanied by cinnamon and cloves. texas made, texas proud, we hope you enjoy the whisky we owe our success to as much as we enjoy making it.",single malt,700.0,balcones distilling,unknown,1
149,ardbeg,drum scotch whisky 700ml,179.99,"limited edition release where in a first for the distillery, ardbeg have taken ardbeg scotch whisky from ex-bourbon casks, then rested in a while in ex-rum casks from the americans to bring a colourful caribbean twist to the peaty favourite.

dark gold in colour, fragrant pine resin and woodsmoke dance alongside ripe banana and pineapple before parading into smoked apples and dry cocoa powder. waves of smoke, tar & creosote lead to a dry peppery mouthfeel.",blended,700.0,scotland,unknown,1
