,name,description,price,product_details,variatal,size,country,closure,target
192,douglas of drumlanri,douglas of drumlanrig ben nevis cask strength 16 year old single cask 54.1% abv,159.0,"dod ben nevis cask strength 16 year old single cask 54.1% abv  this is an extremely rare single cask 16 year old from the ben nevis distillery, bottled by independent bottler douglas of drumlanrig. distilled in december 1998 and bottled in march 2015, matured in american oak ex-bourbon barrels, this single malt scotch whisky is bottled at cask strength (54.1% abv).  unchill filtered with no added colouring, it is limited to only 231 bottles.  distillery: ben nevis independent bottler: douglas of drumlanrig (dod) un-chill filtered, no added colouring category: single malt scotch whisky region: highland bottler: douglas of drumlanrig (dod) stated age: 16 years old casktype: refill bourbon hogshead strength: 54.1 % vol. size: 700 ml tasting notes: nose: sweet orange, floral notes palate: malted barley, rich honey with a nine hint of ripe pear finish: lingering honey with a hint of drying oak",single malt,700.0,scotland,unknown,1
193,the deveron,12 year old single malt scotch whisky 700ml,77.99,"macduff distillery is located near the mouth of the river deveron, where the river meets the sea. sheltered from the worst of the seaboard storms and winter winds, this tranquil spot has seen the creation of the deveron malt whisky for many a decade. using five small copper pot stills and unusual horizontal condensers that gently coax extra character from the spirit, the deveron is a light, fruity and approachable spirit with some hints of nutty notes.",single malt,700.0,scotland,screw cap,0
194,launceston,single malt whisky apera cask 500ml,155.99,"matured in small french oak casks which previously held apera fortified wine (australian-style sherry).

a full flavoured whisky with engaging fragrant aromas, double distilled and non-chill filtered to retain depth of character.

 

colour rich copper.

nose an engaging fragrant aroma, with apera influenced notes of dried fruit, spice and a hint of oak.

taste presenting a soft mouthfeel and subtle flavours of dried fruit, cocoa and gentle spice.

finish a pleasant smooth, lingering finish.



the distillery at hangar 17

launceston distillery produce hand-crafted, small-batch whisky. using traditional techniques and craftsmanship, head distiller chris condon uses tasmanian malted barley and pure river water to produce the finest quality single malt whisky.

from grain to bottle everything happens under the roof of hangar 17, neighbouring launceston airport.",single malt,500.0,australia,cork,1
195,port askaig,islay 100° proof single malt scotch whisky 700ml,134.95,"port askaig islay 100° proof single malt is a cask-strength single malt islay whisky from port askaig. with notes of sweet fruit, peat smoke and minerality, this is a benchmark islay whisky and a great peaty dram.",single malt,700.0,scotland,unknown,1
196,glenmorangie,allta private edition 10 single malt scotch whisky 700ml,139.99,"rounded, biscuity/yeasty tones. gentle floral notes (carnations & parma violets), baking bread, very gentle vanilla, soft raisins and sweet mandarin orange. the taste brings crisp citrus ‘bite’ to the mouthfeel. butter candy, creamy vanilla, orange syrup with yeasty background. gentle mint, the tiniest hint of sweet chilli and delicate, dancing floral notes. allta continues with a long and earthy finish with hints of bitter sweet orange and peppermint.",single malt,700.0,scotland,unknown,1
197,eden mill,single malt whisky,130.0,"the eden mill single malt 2018 release is the first in an annual series which will build over the coming years. we thought it was only appropriate to release this whisky on st andrews day.
 
the 2018 release represents the ultimate blend of some of the best 'honey' casks our distilling team have chosen. 
 
the golden-amber expression comes from a mix of golden promise and propino barley strains and represents the ultimate blend of some of the best ‘honey’ casks eden mill’s distilling team have chosen.
 
young casks have been selected, varying in both size and style including, four of the finest olorosso sherry hogsheads, four outstanding ex-bourbon first fill american standard barrels and a few exceptional octave barrels which previously held pedro ximinez sherry. 

the whisky is presented in a premium crisp, white box – perfect for those looking to add to their whisky collection this festive period.",single malt,700.0,scotland,stopper,1
198,glenfiddich,ipa experiment single malt scotch whisky 700ml,124.99,glenfiddich ipa experiment scotch whisky is the first single malt finished in india pale ale craft beer casks. zesty citrus notes with a hint of fresh hops. experiment over ice with a twist of blood orange.,single malt,700.0,scotland,cork,1
199,old kempton distillery,tasting flight,59.95,"old kempton distillery caters to all tastes with this great introduction gift pack. featuring our embezzler gin, lavender malt and small cask whisky this is the perfect gift and makes a fantastic travel pack!",blended,50.0,australia,screw cap,0
200,glasgow distillery,1770 glasgow whisky - 2019 release,115.0,"crafted by the talented glasgow distillery team of young distillers, glasgow distillery is proud to release their first single malt scotch whisky: 1770.

merging tradition with innovation, we wanted to bring their creation, a single malt that embodied glasgow – original, distinctive and inventive.

laid down in first-fill american oak bourbon casks, 1770 is finished in virgin oak to deliver a full, well rounded palate.
  notes of red berries, pear, toffee, vanilla, marzipan honey and pineapple and hints of pepper and liquorice.",single malt,500.0,scotland,cork,1
201,the arran,malt 14 year old scotch whisky 700ml,114.99,the arran 14-year-old is a smooth richly expression of the arran malt bursting with character and complexity. the extra years of maturation have added a depth of sweetness and spice to create a fully rounded and satisfying dram. the arran malt is the only distillery on the isle of arran and a proudly independent scottish company. independently owned...independently minded.,blended,700.0,scotland,cork,1
202,old pulteney,navigator single malt scotch whisky 700ml,99.99,"appearance: rich golden honeycomb.
aroma: sweet and crisp: tangy apples and dried fruit with hints of chocolate and fresh vanilla.
taste: full bodied and rich: a burst of cocoa, honey and oranges with a long-lasting, spicy finish and suggestion of the sea at the end.",single malt,700.0,scotland,cork,0
203,ardbeg,10 year old scotch whisky 'ardbone' gift pack 700ml,99.99,"this limited edition gift pack pays homage to ardbeg's loyal canine mascot – shortie. the collectable tin is shaped as shortie's most prized possession- his bone and contains a bottle of ardbeg ten years old. perfect for smoky malt lovers, ardbeg is revered around the world as the peatiest, smokiest, most complex single malt in existence. yet it does not flaunt the peat; rather it gives way to the natural sweetness of the malt to produce a whisky of perfect balance.",single malt,700.0,scotland,cork,0
204,paul john sgl malt,bold 46%,94.99,"medium peat; min 5 years matured in ex-bourbon cask. silky with oak-like honey and a hefty second wave of spice, followed by a smoky feel that coats the roof of the mouth leaving a wave of dry molasses, peat and copper notes.",blended,700.0,cheese,cork,0
205,ancnoc,cutter highland single malt scotch whisky 700ml,92.88,"part of the peat series released by ancnoc. cutter is named after the hand tool used to cut peat from drier, shallower bogs. peated to 20.5ppm, this whisky is initially thick with oily smoke which later reveals a piercing burst of fruitiness. ripe peaches and just a touch of oak. leather and spicy vanilla then follow accompanied by notes of pink grapefruit and ripe orchard fruits.",single malt,700.0,scotland,cork,0
206,paul john sgl malt,edited 46%,89.99,light peat; min 5 years matured in ex-bourbon cask. up front grassy flavours of barley followed by subtle peat notes whick slowly dissolve and pave the way for a rush of mint and mocha.,blended,700.0,cheese,cork,0
207,deviant distillery,anthology series single malt spirit,85.0,"for anthology series twenty we’ve crafted a peated malt using a blend of scottish and australian malt barley then aged it using ex px sherry casks to create a bold, rich, & smoky expression with a bouquet of raisins, stewed fruits, plum and orange blossom on the nose, followed by a mild sweet palate and a bold smoke driven finish.

this spirit needs time to acclimatize, so it is best left to breathe for a few minutes before enjoying or serve as part of a sweat, smoky take on a spirit-driven cocktail .",single malt,700.0,australia,cork,0
208,ancnoc,12 year old scotch whisky 700ml,84.99,"ancnoc is a very special and curious distillery. using ancient traditions and practices, ancnoc (pronounced a-knock) produces a very modern whisky that is destined to please all whisky lovers. wonderfully light and delicate to the nose and palate, notes of fresh citrus and honey are present. aged in a carefully selected combination of sherry and bourbon casks, this 12 year old single malt has a incredibly smooth finish and should be considered a malt for every occasion.",single malt,700.0,scotland,unknown,0
209,glendalough,poitin sherry cask finish irish whiskey 700ml,79.99,"outlawed in 1661 by king charles, poitin production was forced into the wilderness where it enjoyed an illicit romanticism as ireland's notorious moonshine. aged for 6 months in virgin irish oak and a further 6 months in sherry casks, it extracts some more depth of flavour and adds honey and raisins. velvet in the mouth and light-amber colour with a smoky wood finish.",blended,700.0,ireland,screw cap,0
210,corowa,"corowa distilling co. the ""mad dog"" morgan 46% 500 ml",165.0,"corowa distilling co. the mad dog morgan 46% 500 mldan mad dog morgan was a ruthless renegade that long ago roamed the corowa region. mad dog wasn't your typical bushranger and this isn't your typical whisky. on the nose; cinnamon, ginger honey, orange and floral noteson the palate; oaky with spice, honey, orange, burnt caramel and raisinsfor the finish; long and sweet with a hint of vanilla.",blended,500.0,wales,unknown,1
211,iniquity,single malt whisky batch # 002,300.0,"this  dram provides pretty much everything you would expect from a small cask, artisan single malt.  superb.
tasting notes at https://iniquity.com.au/products/whisky#batch-no-002",single malt,700.0,south australia,unknown,1
213,bowmore,no. 1 vaults single malt scotch whisky 700ml,159.88,"on the eye: warm gold.
breathe in: vanilla fudge, sea air and peat smoke, balanced beautifully by honeycomb and cinnamon spice.
sip: citrus, gentle saltiness and vanilla with flakes of coconut.
savour: peat smoke, bourbon vanilla and lime.",single malt,700.0,scotland,cork,1
214,civilized spirits,white dog american unoaked whiskey - small batch - 750ml,90.0,"small batch independent spirits 

civilized white dog whiskey unoaked and distilled from wheat to impact a clean, crisp,sweet finishing whiskey. mike hall hand selects the perfect wheat and draws pure, ph-neutral water from our well, creating the foundation for our white dog whiskey with its faint sweetness and uncommon smoothness.

white dog whiskey is distilled from wheat to impact a clean, crisp, sweet finishing whiskey. you’ll find no need to search for nuances that may not be there. all you’ll get is the truth - a refined, micro-batch whiskey of the highest, uncompromising quality.",blended,750.0,usa,stopper,0
215,gordon & macphail,glenburgie 10 year old scotch whisky 700ml,94.99,"fruity with hints of citrus and mulled fruit, sweet and creamy. grapefruit with toffee fudge aromas elements. touch of toasted malt. the palate is rich fruit with sweet, oaky notes, some pepperiness with floral hints. sherry notes with sweet, toffee flavours. a medium, complex whisky with a short finish.",blended,700.0,scotland,cork,0
216,glengoyne,35 year old scotch whisky 700ml,5000.0,"this 35-year-old whisky from glengoyne distillery of the southern highlands makes for an exceptional rare and special single malt. this is an instant collector''s item with only 500 decanters available worldwide with each individually numbered. the whisky comes packaged in an wooden case which includes a leather-bound book signed by distillery manager robbie hughes. the single malt itself offers notes of apple followed by hints of dried fruit, floral and gentle spice flavours. don''t miss out on this rare drop.",single malt,700.0,scotland,cork,1
217,gordon & macphail,balblair 10 year old scotch whisky 700ml,109.99,"balblair is a highland malt located just beyond glenmorangie on the dornoch firth. pale gold in colour, the nose is like fresh hay with sweet marshmallow notes. dig deep to find elements of stewed pear. first taste will give an early mouth warming flavour of chilli spice and citrus fruit. smooth and creamy thereafter with a delicate floral influence. it is a smooth and delicate whisky with a surprising long finish.",blended,700.0,scotland,cork,1
218,ardbeg,auriverdes scotch whisky 700ml,194.99,"distilled with equal measures of skill and passion, ardbeg auriverdes was released in time for ardbeg day in 2014. the dram - golden whisky (auri), unmistakeable green bottle (verde) - is also rumoured to be a bit of a hot head on account of its toasted cask lids. the ardbeg team is renowned for its technical expertise and auriverdes is a winning example of this, with the toasted lids producing a mocha coffee flavour at one end, flowing into creamy vanilla at the other, finished by a lingering, smoky vanilla note.",blended,700.0,scotland,cork,1
219,the last drop,1968 glenrothes cask 13508 single malt whisky 700ml,10000.0,"with only 309 bottles produced worldwide, the last drop 1968 single malt scotch whisky is the ultimate in rare and collectible whiskies. cask 13508 yielded 141 bottle sets. complex, mellow aromas are at once fruity and herbal with an elusive whiff of scented smoke, a trace of cigar boxes and after a while a hint of candlewax. the texture is oily and the taste sweet and centre palate, with some saltiness and peppery spice in the long warming finish and a slightly mentholic aftertaste. comes with a 50ml miniature, elegant leather box and booklet.",single malt,700.0,scotland,cork,1
220,glenglassaugh,rare cask collection 8 x 700ml,35000.0,"an extremely limited collection of which only 5 sets are being made with 1 set being kept by the supplier to treasure. this beautiful selection features whiskies that are no younger than 30 years old, and provides a unique glance into the history of the distillery and the heart of glenglassaugh. these elegant old whiskies offer a lush, ripe highland single malt scotch whisky experience, evoking notes of tropical fruit and the sea, while each cask type offers a unique taste influence. and were hand selected by master distiller, billy walker. ",single malt,700.0,scotland,cork,1
221,bunnahabhain,40 year old single malt scotch whisky 700ml,3500.0,"celebrating its extraordinary journey and its recovery by master distiller, ian macmillan, is its label. specially created by renowned scots illustrator iain mcintosh it retraces the story from the water source at margadale spring to bunnahabhain distillery, from the ledgers to the turney casks - the illustration recounts the timeless passion and dedication which has gone into this truly exceptional whisky.",single malt,700.0,scotland,cork,1
222,mars,komagatake double cellars single malt japanese whisky 700ml,244.99,"this very limited edition of single malt, was specially vatted from the cellars of two mars whisky distilleries and bottled in early 2018. originally distilled at mars shinshu distillery in nagano prefecture in 2014 and then a portion of it was aged in bourbon and american white oak casks at shinshu distillery. the remaining portion was sent to mars tsunuki distillery in kagoshima, and aged in bourbon casks. tsunuki is some 1000km south-west of shinshu, and the cool climate and high altitude in shinshu versus the warm and tropical climate in tsunuki, provide a different ageing environment that give interesting individual characters in the final whisky when bottled. it is quite complex with a gentle texture, with plum and vanilla notes on the palate with a hint of peat and sweet honey on the finish.",single malt,700.0,japan,screw cap,1
223,mortlach,cowie's blue seal 20 years old single malt whisky 750ml,359.99,a selection of our very best single malt scotch whisky has been matured for a minimum of 20 years to tame “the beast of dufftown” into smooth submission and mellow complexity. it is a whisky that would have made the great alexander cowie proud.,single malt,750.0,scotland,cork,1
224,wolfburn,langskip single malt 700ml,129.99,"langskip is wolfburn’s first (near) cask-strength release. 
matured entirely in first-fill bourbon casks for over five years, making langskip the distillery’s oldest whisky to date.",single malt,700.0,scotland,unknown,1
225,amrut,amrut naarangi indian whisky 50% 700ml,184.0,"single malt whisky finished in orange sherry cask. amrut procured oloroso sherry from spain, then infused the sherry with fresh orange peels. the sherry was emptied and the cask filled with amrut single malt for further maturation. it is the only single malt whisky ever produced in the world to have expressions of orange, which brings forth a new level of experimentation to the malt world. the result in an essay in elegance: notable yet not dominant orange sherry notes perfectly fused into the whisky flavour. hence the name 'naarangi' - orange in hindi. an aromatic tug of war between suet pudding and dried figs with moderate teasing of orangey citrus. with time, more dried fruits stunningly evolve. viscous, full bodied like a syrup. transcending and sweet. slightly dry finish, though one can neglect it. the finish is moderately sweet with a loud dance of orange through the finale.",single malt,700.0,india,cork,1
226,the glendronach,grandeur batch 10 27 year old 700ml,1250.0,"the whisky bottled as the glendronach ‘grandeur’ has been specially selected by our master blender, rachel barrie, from some of our oldest and most unique sherry casks at glendronach. a selection of barrels, hogsheads, puncheons and butts have been maturing in our traditional dunnage warehouses since the 1960s, and it is the most extraordinary and remarkable of sherry casks that have been chosen for this very special bottling of twenty-seven-year-old whisky.

this superb expression is a fantastic representation of the smooth, complex and full-bodied style that the glendronach distillery is famous for. individually numbered by hand, each bottle is a one-off and truly unique.",blended,700.0,scotland,cork,1
227,highland park,30 year old single malt scotch whisky 700ml,1900.0,"the highland park 30 year old has a fudgy sweetness that characterises the more mature highland park, combined with complex aromatic spices as well as dark chocolate orange and floral peat notes. dry at the finish, it leaves an aromatic smoky flavour and a mouth-watering hint of mild, salty sea spray – the result of 30 years’ maturation on orkney’s windswept island environment.",single malt,700.0,scotland,unknown,1
228,gordon & macphail,connoisseurs choice jura 1997 scotch whisky 700ml,179.99,"jura, a neighbour to islay but the only distillery on the sparsely populated island. the whisky has a delicate nose with hints of ripe tropical fruits and citrus peel. sweet honey aromas develop in the glass. a drop of water brings out soft toffee, ripe peach and a subtle menthol edge. the taste is initially peppery with green apples and a slight saltiness. a light island malt with a medium creamy finish.",blended,700.0,scotland,cork,1
229,clynelish,select reserve scotch whisky 700ml,925.0,"a very complex whisky that moves smoothly from waxy high notes of rich fruit and sweet butterscotch, through deep warmth, to the silky, dark dryness of an aromatic finish. evocative, confident and joyful, it is astonishingly fresh yet speaks of the past, layering the classic coastal ozone, brine and peat with fragrant, fruity complexity and sweet warmth and even easier to enjoy with water, which exposes its lighter side and raises more elegant layers of creamy flavour.",blended,700.0,scotland,cork,1
230,pittyvaich,25 year old scotch whisky 700ml,500.0,"this pittyvaich 25 year old was distilled in 1989 and has lived longer than the distillery did. this limited edition whisky is easy to drink at natural strength yet is also a complex, attractive and slender whisky, ideal for after dinner contemplation: well balanced, with a sweet, malty nose and palate, and also a refined oiliness and subtle pungency, with a smooth, aromatic and drying conclusion. just 5922 individually numbered bottles available world-wide.",blended,700.0,scotland,cork,1
231,craigellachie,23 year old single malt scotch whisky 700ml,760.0,"craigellachie 23 year old single malt scotch whisky is a masterpiece in old fashioned whisky making. this 23 year old has added spice, ripe fresh cooked and dried fruits with a touch of light peat smoke on the nose. the palate is filled with flavours of melted white chocolate, baked pineapple followed by spicy oak towards the finish. it is complex, deep and well structured. an elegant scotch whisky that could be enjoyed neat, on the rocks or with a dash of water.",single malt,700.0,scotland,screw cap,1
232,the arran,malt 10 year old scotch whisky 700ml,95.99,"officially launched in 2006, this 10-year-old lies at the heart of the isle of the arran range. it exudes all the honeyed richness that is associated with the island distillery. the arran 10-year-old is a fresh and vibrant expression of the arran malt with all the hallmarks of the classic island style. vanilla and citrus notes dominate to create a smooth and mellow taste. the arran is the only distillery on the isle of arran and a proudly independent scottish company. independently owned...independently minded.",blended,700.0,scotland,cork,0
233,wolfburn,morven single malt scotch whisky 700ml,99.99,a lightly peated whisky made from malted barley infused with peat smoke (10 ppm) during the drying process. matured in ex-bourbon barrels and quarter casks.,single malt,700.0,scotland,unknown,0
234,teeling,30 year old single malt irish whiskey 700ml,2400.0,"the teeling vintage reserve 30 year old platinum bottling is one of the oldest single malt irish whiskeys ever released. this platinum bottling has been limited to only 250 bottles making this one of the world’s most exclusive irish whiskeys. having been distilled in 1983 and allowed to rest for over 30 years in bourbon cask, this limited edition whiskey has been hand selected by our master blender for its distinctive taste qualities. the whiskey has inherited a huge amount of character over its 30 year journey leading to a complex floral nose with deep layered flavours and a long luxurious finish. the teeling vintage reserve 30 year old platinum bottling is exceptional not only in taste but also in its rarity.",single malt,700.0,ireland,stopper,1
235,pittyvaich,28 year old single malt scotch whisky 700ml,500.0,"from a closed distillery, the oldest 1989 pittyvaich yet in this series, with only 4,680 bottles available worldwide. complex and compelling; light and straightforward, yet also full-flavoured and forceful. opened in 1975, pittyvaich was one of the shortest-lived distilleries ever built on speyside; the innocent victim of industry restructuring, it closed in 1993 through no fault of its whisky and has long since been demolished. unsurprisingly, its pleasing single malt has never been widely available, though it has been proven to age well; none younger than 25 years of age remains. most closed distilleries have produced for decades, even centuries before their closure, but
pittyvaich lived for a mere eighteen years. the name is gaelic and may refer to an early dwelling on the site, a ‘farmstead at the birch wood’. the distillery was, however, an impressive and ultramodern state of the art building, built around stills that were an exact replica of those at dufftown, then its sister distillery. pittyvaich, it was said, was designed around its plant and not, as is often the case with older distilleries, vice versa",single malt,700.0,scotland,unknown,1
236,old kempton distillery,single malt ex pinot cask 500ml,219.99,"our ex-pinot cask single malt whisky is matured using 20l and 100l barrels in our 1840’s stable. a stunning caramel colour with brown sugar on the nose, a long finish and smooth palate. enjoy neat or over ice.",single malt,500.0,australia,unknown,1
237,michel couvreur,intravaganza whisky 700ml,129.99,"using fresh sherry casks, the michel couvreur intravaganza single malt whisky is matured between two and three years after distillation in scotland. bottled at its natural 50% alcohol strength, aromas of frangipane and almonds are present along with touches of wood, honey and grassy fresh notes.",single malt,700.0,scotland,unknown,1
238,mannochmore,25 year old scotch whisky 700ml,500.0,"mannochmore lies south of elgin on speyside and draws water from a source in the nearby mannoch hills, after which the distillery is named. close by, walkers in dense woodland around millbuies loch may glimpse the striking 'up and down' flight of the great spotted woodpecker.",blended,700.0,scotland,unknown,1
